ID;Reference;Designation;Mill;Coul;Cond;Cont
2878;CDH-191003;AOP VINS DE SAVOIE GAMAY;2012;RGE;x 6;75 cl
2879;CDH-191004;AOP VINS DE SAVOIE MONDEUSE;2013;RGE;x 6;75 cl
2880;CDH-195001;AOP CAHORS CHATEAU LAMARTINE;2011;RGE;x 6;75 cl
2881;CDH-195002;AOP GAILLAC DME DES TERRISSES;2011;RGE;x 6;75 cl
2882;CDH-195003;AOP JURANCON SEC CLOS LAPEYRE BIO;2012;BLC;x 6;75 cl
2883;CDH-195004;AOP JURANCON MOELLEUX CLOS LAPEYRE BIO;2012;BLC;x 6;75 cl
2884;CDH-195005;AOP MADIRAN DOMAINE BERTHOUMIEU;2010;RGE;x 6;75 cl
2885;CDH-195006;AOP PACHERENC DOUX CHARLES DE BATZ;2012;BLC;x 6;75 cl
2887;041013;AC SAINT ESTEPHE HAUTS DE PEZ;2011;RGE;x 6;75 cl
2888;CDH-191005;AC VIN DE SAVOIE ABYMES;2013;BLC;x 6;75 cl
2889;075013;AC MEDOC CRU BOURGEOIS CHATEAU DES CABANS;2013;RGE;x 6;75 cl
2890;CDH-194002;AC MOULIS EN MEDOC CHATEAU CHEMIN ROYAL;2009;RGE;x 6;75 cl
2891;198001H;MARQUISE DES LYS BLANC DE BLANC;0;BLC;x 6;75 cl
2892;096010H;AC GRAVES CHATEAU DE L'HOSPITAL;2011;RGE;x 6;75 cl
2893;CDH-181011;AC PAUILLAC CHATEAU BELLEGRAVE;2011;RGE;x 6;75 cl
2894;CDH-181012;AC PAUILLAC CHATEAU BELLEGRAVE;2011;RGE;x 6;150 cl
2895;CDH-181506;AC SAINT JULIEN CHATEAU DU GLANA;2011;RGE;x 6;75 cl
2896;CDH-181507;AC SAINT JULIEN CHATEAU DU GLANA;2011;RGE;x 6;150 cl
2897;197001H;AOP RASTEAU DOMAINE DE LA COLLIERE;2014;RGE;x 6;75 cl
2899;CDH-164005;AC ST EMILION GRAND CHATEAU JUCALIS;2005;RGE;x 6;75 cl
2900;CDH-561001;AC HAUTS MEDOC DEMOISELLE DE SOCIANDO MALLET;2009;RGE;x 6;75 cl
2901;CDH-192001;VIN DE FRANCE LES FILLES DE LA GUINGUETTE MARQUISE;2013;RGE;x 6;75 cl
2902;CDH-192002;AC SAINT CHINIAN METISS MARQUISE DES MURES;2010;RGE;x 6;75 cl
2903;CDH-192003;AC SAINT CHINIAN LES SAGNES MARQUISE DES MURES;2008;RGE;x 6;75 cl
2904;CDV039034;AC RIVESALTES AMBRE;0;RGE;x 1;B05L
2909;025039;BIB 10L IGP OC;0;RGE;x 1;B10L
2910;025040;IGP HAUTE VALLEE DE L'AUDE;0;BLC;x 1;B10L
2912;CDH-196002;VINO DE BARRIOBERO NUESTRAS;2012;RGE;x 6;75 cl
2913;801001H;AC HAUTES COTES DE BEAUNE BLANC;2014;BLC;x 6;75 cl
2915;107004H;AC MARGAUX DEYREM VALENTIN;2010;RGE;x 6;75 cl
2917;CDH-805003;AC GEVREY CHAMBERTIN LES CRAIS;2012;RGE;x 6;75 cl
2918;CDH-561002;AC HAUT MEDOC SOCIANDO MALLET;2009;RGE;x 6;75 cl
2919;CDH-073109;AC ST ESTEPHE DAME DE MONTROSE;2009;RGE;x 12 CB;75 cl
2920;191001H;AC VIN DE SAVOIE APPREMONT;2014;BLC;x 6;75 cl
2921;191004H;AC VIN DE SAVOIE MONDEUSE;2016;RGE;x 6;75 cl
2922;801003H;AC HAUTES COTES DE BEAUNE ROUGE;2014;RGE;x 6;75 cl
2924;CDV114001;AC TOURAINE D.LA CHAISE;2013;BLC;x 6;75 cl
2925;CDH-199001;AC COTEAUX DU LANGUEDOC LA CHAPELLE;2010;RGE;x 6;75 cl
2926;CDH-199002;AC COTEAUX DU LANGUEDOC PRIEURE ST JEAN DE BEBIAN;2010;RGE;x 6;75 cl
2927;127011H;AC CONDRIEU MARTHOURET;2014;BLC;x 6;75 cl
2933;194002H;AC MOULIS EN MEDOC CH CHEMIN ROYAL;2011;RGE;x 6;75 cl
2935;CDH-073010;CHATEAU TALBOT ST JULIEN 4 CRU CLASSE;2009;RGE;x 12 CB;75 cl
2936;CDH-052102;AC ST JULIEN CH GRUAUD LAROSE;2009;RGE;x 12 CB;75 cl
2937;CDH-073101;AC MARGAUX RAUZAN SEGLA;2009;RGE;x 6;75 cl
2938;CDH-995003;CAISSE BOIS 2 BOUTEILLES;0;;x 1;75 cl
2939;CDV153003;AC CHABLIS DOMAINE GARNIER;2013;BLC;x 6;75 cl
2940;201001;IGP VAUCLUSE D'ORANGE CAVE LES COTEAUX DU RHONE;2013;RGE;x 1;B05L
2941;201002;IGP VAUCLUSE D'ORANGE CAVE LES COTEAUX DU RHONE;0;RGE;x 1;B10L
2942;201003;IGP MEDITERRANEE LES COTEAUX DU RHONE;0;RSE;x 1;B05L
2943;201004;IGP MEDITERRANEE LES COTEAUX DU RHONE;0;RSE;x 1;B10L
2945;201006;AOP COTES DU RHONE MAGIE D'UNE TERRE;2015;RGE;x 6;75 cl
2946;201007;AOP VACQUEYRASDOMAINE GRANDY;2014;RGE;x 6;75 cl
2947;201008;AOP COTES DU RHONE PATRICE NICOLAS;2015;RGE;x 6;75 cl
2949;202001;IGP VAUCLUSE LEA;2014;RGE;x 6;75 cl
2950;202002;IGP VAUCLUSE LEA;2015;RSE;x 6;75 cl
2951;202003;IGP VAUCLUSE LEA;2015;BLC;x 6;75 cl
2952;202004;AOP LUBERON FIEF;2014;RGE;x 6;75 cl
2953;202005;AOP LUBERON FIEF;2014;RSE;x 6;75 cl
2954;202006;AOP LUBERON FIEF;2014;BLC;x 6;75 cl
2955;201010;AOP COTES DU RHONE;0;RGE;x 1;B10L
2956;201011;AOP COTES DU RHONE;0;RGE;x 1;B05L
2957;201012;AOP CDR VILLAGES PLAN DE DIEU PANICAUT;2013;RGE;x 6;75 cl
2958;201013;AOP CDR VILLAGES CAIRANNE LA BOSQUETTE;2013;RGE;x 6;75 cl
2959;201014;AOP COTES DU RHONE VILLAGES JASOUN;2014;RGE;x 6;75 cl
2960;201015;AOP CDR VILLAGES MASSIF D'UCHAUX ARBOUSE;2013;RGE;x 6;75 cl
2962;CDH-565001;AC ST JULIEN CONNETABLE DE TALBOT;2010;RGE;x 6;75 cl
2963;CDV035001;AC SAINT NICOLAS DE BOURGUEIL;2012;RGE;x 6;75 cl
2964;CDV201009;AOP COTES DU RHONE PATRICE NICOLAS;2013;RSE;x 6;75 cl
2966;201022;IGP PRINCIPAUTE D'ORANGE;0;RSE;x 1;B03L
2967;201023;AC COTES DU RHONE;0;RGE;x 1;B03L
2968;201020;AC VACQUEYRAS (carton de 6 bib);0;RGE;x 6 CB;B03L
2969;CDH-125003;AC SAUTERNES GD CARRETEY;0;BLC;x 12 CB;37.5 cl
2970;002200;ROSE PAMPLEMOUSSE;0;RSE;x 1;B03L
2971;164010;AOP SAINT EMILION JUPILLE CARILLON;0;RGE;x 1;B05L
2974;164005/10;AC ST EMILION G. CRU CH JUCALIS;2010;RGE;x 6;75 cl
2976;059101;ICE PAMPLOON ROSE PAMPLEMOUSSE;0;RSE;x 6;75 cl
2977;059104;ICE PAMPLOON BUBBLES;0;RSE;x 6;75 cl
2978;059102;ICE NECTARINES BLANC;0;BLC;x 6;75 cl
2979;059103;ICE GRIOTTES ROUGE;0;RGE;x 6;75 cl
2980;CDV002017;IGP GARD GALLICIAN;0;RSE;x 1;B10L
2981;204001H;AC VENTOUX;0;RGE;x 1;B10L
2986;204002H;AC VENTOUX;0;RGE;x 1;B05L
2987;204003H;AC VENTOUX;0;RSE;x 1;B10L
2988;204004H;AC VENTOUX;0;RSE;x 1;B05L
2989;CDH-180002;AC MEDOC CHATEAU DE LA BRANNE;2010;RGE;x 6;75 cl
2991;205001;IGP COTES DE GASCOGNE SEC COLOMBARD G-MANSENG MISE;2015;BLC;x 6;75 cl
2992;205002;IGP COTES DE GASCOGNE;2015;RSE;x 6;75 cl
2993;205003;IGP COTES DE GASCOGNE PETIT MANSENG;2014;BLC;x 6;75 cl
2994;205004;IGP COTES DE GASCOGNE MERLOT-TANNAT;2014;RGE;x 6;75 cl
2995;675001;EMBALLAGE BLANC BIB  5L;0;;x 1;B05L
2998;206001H;IGP D'OC CHARDONNAY BACHELLERY;2013;BLC;x 6;75 cl
2999;206002H;IGP D'OC GRENACHE BACHELLERY;2012;RGE;x 6;75 cl
3000;206003H;IGP D'OC PINOT BACHELLERY;2015;RGE;x 6;75 cl
3001;206004H;IGP D'OC BLANC DOMAINE DE MUS;2014;BLC;x 6;75 cl
3002;206005H;IGP D'OC ROSE DOMAINE DE MUS;2014;RSE;x 6;75 cl
3003;206006H;IGP D'OC ROUGE DOMAINE DE MUS;2015;RGE;x 6;75 cl
3006;CDH-206005;IGP D'OC DOMAINE DE MUS;2014;RSE;x 12 CB;75 cl
3007;CDH-206006;IGP D'OC DOMAINE DE MUS;2012;RGE;x 6;75 cl
3008;CDH-199003;AOP COTEAUX DU LANGEUDOC CROIX DE BEBIAN;2011;RGE;x 6;75 cl
3009;CDH-199004;AOP COTEAUX DU LANGUEDOC CROIX DE BEBIAN;2013;BLC;x 6;75 cl
3010;CDH-199005;AOP COTEAUX DU LANGEUDOC PRIEURE;2012;BLC;x 6;75 cl
3011;046020;AC COTEAUX DU LANGUEDOC ENFANT TERRIBLE;2013;RGE;x 6;75 cl
3012;046025;IGP MONTBAUDILE;2014;BLC;x 6;75 cl
3016;204005H;AOP VENTOUX ANTHERA;2015;RGE;x 6;75 cl
3017;204006H;AOP VENTOUX PENSEE SAUVAGE;2015;RSE;x 6;75 cl
3018;204007H;AOP VENTOUX LA GRANGE DELAY;2013;RGE;x 6;75 cl
3019;099020;IGP PAYS D'OC SIMPLEMENT ORMARINE;2013;RSE;x 6;75 cl
3020;099021;IGP PAYS D'OC SIMPLEMENT ORMARINE;2015;BLC;x 6;75 cl
3021;209001H;AOP VOUVRAY DOMAINE DU PETIT COTEAU;2013;BLC;x 6;75 cl
3025;199001;AC COTEAUX DU LANGUEDOC CHAPELLE;2012;RGE;x 6;75 cl
3026;CDV-199002;AC COTEAUX DU LANGUEDOC PRIEURE ST JEAN DE BEBIAN;2010;RGE;x 6;75 cl
3027;199003;AC COTEAUX DU LANGUEDOC LA CROIX DE BEBIAN;2015;RGE;x 6;75 cl
3028;199004;IGP PAYS D'OC LA CROIX DE BEBIAN;2014;BLC;x 6;75 cl
3029;CDV-199005;AC COTEAUX DU LANGUEDOC PRIEURE ST JEAN DE BEBIAN;2012;BLC;x 6;75 cl
3031;207001H;AOP CLAIRETTE DE DIE;0;BLC;x 6;75 cl
3032;CDH-187002;IGP CEVENNES ROSE;2013;RSE;x 1;B05L
3033;CDH-187003;IGP CEVENNES BLANC;0;BLC;x 1;B05L
3034;CDH-187004;IGP DES CEVENNES;0;RGE;x 6;75 cl
3035;CDH-187005;IGP DES CEVENNES;2013;RSE;x 6;75 cl
3036;CDH-187006;IGP DES CEVENNES;2013;BLC;x 6;75 cl
3037;CDV099020;IGP D'OC SIMPLEMENT ORMARINE;2013;RSE;x 6;75 cl
3038;CDV099021;IGP D'OC SIMPLEMENT ORMARINE;2015;BLC;x 6;75 cl
3043;CDV199005;AC COTEAUX DU LANGUEDOC PRIEURE ST JEAN DE BEBIAN;2013;BLC;x 6;75 cl
3045;CDV114010;AC TOURAINE SAUVIGNON;0;BLC;x 1;B10L
3046;210001H;AOP MINERVOIS Tradition DME PUJOL-IZARD;2014;RGE;x 6;75 cl
3047;210002H;AOP MINERVOIS DME PUJOL-IZARD;0;RGE;x 1;B05L
3048;210003H;AOP MINERVOIS DME PUJOL-IZARD;0;RGE;x 1;B10L
3050;CDV019003;AC BDX SUP. CH LES HAUTS DE PEREY;2012;RGE;x 6;75 cl
3051;CDV062021;AOP GRAVES CH CARBON D'ARTIGUES;2013;BLC;x 6;75 cl
3052;CDH-187007;IGP CEVENNES RGE;0;RGE;x 4;B03L
3053;CDH-187008;IGP CEVENNES RSE;0;RSE;x 4;B03L
3054;CDH-187009;IGP CEVENNES BLC;0;BLC;x 4;B03L
3055;160002H;IGP GARD CHAMPETRE;2014;RGE;x 12;75 cl
3056;CDV075001;AC MEDOC CH LE BREUIL RENAISSANCE;2008;RGE;x 12;75 cl
3057;188002H;AC LIRAC DME CORNE LOUP;2012;RGE;x 6;75 cl
3058;CDV002018;IGP GARD GALLICIAN;0;RSE;x 1;B05L
3059;211001H;AC COTEAUX DE L'AUBANCE DME DES ROCHETTES;2014;BLC;x 6;75 cl
3060;203002H;AOP COTES DE BOURG CHATEAU HAUT GUIRAUD;2012;RGE;x 6;75 cl
3063;CDV164003;AC SAINT EMILION JUPILLE CARILLON;2009;RGE;x 12;37.5 cl
3064;CDV201025;IGP ORANGE ROSE;0;RSE;x 1 CB;B03L
3065;162004;AOP CABARDES CUVEE GUILLAUME;2013;RGE;x 6;75 cl
3066;192001H;VIN DE FRANCE LES FILLES DE LA GUINGUETTE;2013;RGE;x 6;75 cl
3067;CDV202002;IGP VAUCLUSE;2013;RSE;x 6;75 cl
3068;CDV202003;IGP VAUCLUSE;2013;BLC;x 6;75 cl
3069;084037;AOP CORBIERE LE JARDIN DU PARADIS;0;RGE;x 6;75 cl
3070;084038;AOP CORBIERE LE JARDIN DU PARADIS;0;RGE;x 6;150 cl
3072;084040;AOP CORBIERE SOLEIL LIQUIDE;0;RGE;x 6;150 cl
3073;CDV035008;AC BOURGUEIL DOMAINE OLIVIER;0;RGE;x 1;B05L
3074;CDV094002;AC MOULIS EN MEDOC GD POUJEAUX;0;RGE;x 12;37.5 cl
3076;040021;AC COTES DE BOURG SALMANAZAR ( 9 L ) CAISSE BOIS;2011;RGE;x 1;62 cl
3077;192002H;AC SAINT CHINIAN METISS MARQUISE DES MURES;2010;RGE;x 6;75 cl
3078;CDH-012001;IGP DES CEVENNES PIERRES CHAUDES;2013;RGE;x 6;75 cl
3079;196002H;RIBERA DEL DUERO SAN QUIRCE;2012;RGE;x 6;75 cl
3080;059027;IGP MEDITERRANEE TERES;0;RSE;x 1;B10L
3081;084004;VDT BUVETTE CASTELMAURE (x6);0;RGE;x 6;75 cl
3082;CDH-165012;AC CABERNET D'ANJOU;0;RSE;x 1;B10L
3083;CDV040021;AC COTES DE BOURG SALMANAZAR 9L;2011;RGE;x 1;LITRE
3085;211002;IGP CEVENNES SYRAH JARDIN DES IRIS;2014;RSE;x 6;75 cl
3086;211003;IGP CEVENNES CHARDONNAY JARDIN DES IRIS;2014;BLC;x 6;75 cl
3088;211010;IGP OC MERLOT JARDIN DES IRIS;2014;RGE;x 1;B03L
3089;211011;IGP OC SYRAH JARDIN DES IRIS;2014;RSE;x 1;B03L
3090;211012;IGP OC CHARONNAY JARDIN DES IRIS;2014;BLC;x 1;B03L
3092;211001;IGP CEVENNES MERLOT SYRAH JARDIN DES IRIS;2014;RGE;x 6;75 cl
3093;002032;IGP D'OC CABERNET SAUVIGNON;2012;RGE;x 6;75 cl
3094;002033;AOP COSTIERES DE NIMES;0;RGE;x 1;B03L
3095;002034;AOP COSTIERES DE NIMES;0;RSE;x 1;B03L
3096;002035;AOP COSTIERES DE NIMES;0;BLC;x 1;B03L
3097;CDV035002;AC ST NICOLAS DE BOURGUEIL;2012;RGE;x 12;37.5 cl
3098;CDV173012;MUSCAT;2012;BLC;x 6;75 cl
3099;036011;IGP ST GUILHEM LE DESERT;0;RGE;x 1;B05L
3100;CDV173013;AC RIESLING;0;BLC;x 12;37.5 cl
3102;201016;AC COTES DU RHONE MAGIE D'UNE TERRE;2014;RGE;x 12;37.5 cl
3103;184003H;AC CREMANT DE LOIRE DOMAINE GAGNEBERT;0;BLC;x 6;75 cl
3104;037003;AC CHINON;2014;RGE;x 6;75 cl
3105;058004H;AC HAUT MEDOC LA PETITE DEVISE;2011;RGE;x 6;75 cl
3106;052066;AC BORDEAUX CHATEAU DE BELCIER;2009;RGE;x 6;75 cl
3107;052067;CH RAMAGE LA BATISSEAC HAUT MEDOC CRU BOURGEOIS;2006;RGE;x 6;75 cl
3108;213001H;AOP MADIRAN DME DU MOULIE;0;RGE;x 6;75 cl
3110;CDV086001P;AC COTES DE DURAS;0;RGE;x 1;B10L
3111;CDV086002P;AC COTES DE DURAS;0;RGE;x 1;B05L
3112;107005H;AC MARGAUX DEYREM VALENTIN;2012;RGE;x 6;75 cl
3113;107006H;AC MARGAUX DEYREM VALENTIN;2012;RGE;x 6;150 cl
3114;048003;AC PUISSEGUIIN ST EMILION;2009;RGE;x 6;75 cl
3116;212001H;AOP CAHORS La Rangée du Curé DOMAINE CAPELANEL;2014;RGE;x 6;75 cl
3117;095017;AC CHABLIS;0;BLC;x 1;B10L
3119;214001H;IGP etc  COMTE TOLOSAN MALBEC CAB FRANC;0;RGE;x 6;75 cl
3120;215001H;AOP HAUT MEDOC CH TOUR MARCILLANET;2011;RGE;x 6;75 cl
3121;216001H;AC PREMIERES COTES DE BLAYE LES GRAVES DAVID;2012;RGE;x 6;75 cl
3122;CDH-187010;IGP DES CEVENNES;0;RSE;x 1;B10L
3123;176001H;UTIEL REQUENA ARANLEON CRIANZA;2009;RGE;x 6;75 cl
3124;176004H;UTIEL REQUENA ARANLEON AHORA;2011;RGE;x 6;75 cl
3125;011004;AC VOUVRAY METHODE TRAD BUT CUVEE ZERO;0;BLC;x 6;75 cl
3126;011006;AC VOUVRAY ARGILEX;2015;BLC;x 6;75 cl
3127;062043;BARRIQUE FUT DE CHENE;0;;x 1;75 cl
3128;CDV062022;AC GRAVES CARBON D'ARTIGUES;2013;BLC;x 24;37.5 cl
3129;CDH-206015;IGP D'OC BALLADE EN STRAMINER;0;BLC;x 6;75 cl
3130;169005CB;AC COTES DE CASTILLON CB 3 BOUTEILLES;2010;RGE;x 3;75 cl
3131;178008H;IGP D'OC MERLOT CABERNET;2015;RGE;x 6;75 cl
3132;126005H;AC MORGON DOMAINE DUBOST;2013;RGE;x 6;75 cl
3133;126006H;AC BROUILLY DOMAINE DUBOST;2013;RGE;x 6;75 cl
3134;126007H;AC MOULIN A VENT DOMAINE DUBOST;2013;RGE;x 6;75 cl
3135;CDH-138010;AC VENTOUX GAVOT DES ABEILLES;2011;RGE;x 6;75 cl
3136;217001H;AC COTES DU RHONE SEGURET CLOS DU JONCUAS;2014;RGE;x 6;75 cl
3137;217002H;AC VACQUEYRAS LA FOND DE PAPIER CLOS DU JONCUAS;2010;RGE;x 6;75 cl
3138;217003H;AC GIGONDAS CLOS DU JONCUAS;2012;RGE;x 6;75 cl
3139;601006H;IGP COTES DE GASCOGNE GROS MANSENG;2013;BLC;x 12;37.5 cl
3140;017001H;AOP JURANCON SEC TRADITION;2014;BLC;x 6;75 cl
3141;017005H;AOP JURANCON SEC LA PIERRE BLANCHE;2011;BLC;x 6;75 cl
3142;017010H;AOP JURANCON MOELLEUX;2012;BLC;x 6;75 cl
3143;051002CB;AC ST EMILION GRAND CRU CLOS TRIMOULET CAISSE BOIS;2010;RGE;x 3;75 cl
3144;CDV143002;AC COTEAUX GIENNOIS;2012;BLC;x 6;75 cl
3145;CDH-191006;AC ROUSSETTE DE SAVOIE;0;BLC;x 6;75 cl
3147;CDH-107002;AC MARGAUX DEYREM VALENTIN;2009;RGE;x 6;75 cl
3148;157005H;VDP DE LOIRE SAUVIGNON;2012;BLC;x 6;75 cl
3149;041014;AC ST ESTEPHE HAUTS DE PEZ;2011;RGE;x 12;37.5 cl
3150;096007H;AC GRAVES CH DE L'HOSPITAL;2009;RGE;x 6;150 cl
3151;169010;AOP COTES DE BORDEAUX LES HAUTS DE PERREAU BEL AIR;0;RGE;x 1;B05L
3153;169009;AOP COTES DE BORDEAUX LES HAUTS DE PERREAU BEL AIR;0;RGE;x 1;B10L
3154;211015;IGP OC MERLOT JARDIN DES IRIS;2014;RGE;x 1;B05L
3155;211016;IGP OC SYRAH JARDIN DES IRIS;2014;RSE;x 1;B05L
3156;211017;IGP OC CHARDONNAY JARDIN DES IRIS;2014;BLC;x 1 CB;B05L
3157;125001H;AC SAUTERNES CH GRAND CARRETEY;2011;BLC;x 6;75 cl
3158;206015H;IGP D'OC BALLADE EN STRAMINER;2014;BLC;x 6;75 cl
3159;002036;IGP D'OC MERLOT - CARTON GALLICIAN;0;RGE;x 1;B10L
3160;168020CB;AOP GRAVES CH LA ROSE SARRON CAISSE BOIS 3 BLLES;2011;RGE;x 3;75 cl
3163;CDH-059025;VDP MEDITERRANEE TERES;2013;RSE;x 6;75 cl
3164;181508H;AC ST JULIEN  CHATEAU DU GLANA;2013;RGE;x 6;75 cl
3165;181013H;AC PAUILLAC CHATEAU DE BELLEGRAVE;2013;RGE;x 6;75 cl
3168;CDH-182003;AOP ST ESTEPHE SEGUR DE CABANAC;2012;RGE;x 6;150 cl
3169;CDH-182004;AOP ST JULIEN CHATEAU MOULIN DE LA ROSE;2012;RGE;x 6;150 cl
3170;100001H;AC COTE ROTIE DOMAINE PARPETTE;2014;RGE;x 6;75 cl
3172;218001H;AOP SAUMUR CHAMPIGNY PLAISIR DE ST JEAN;2014;RGE;x 6;75 cl
3174;CDH-158001;AC POUILLY FUME DME BARDIN;2013;BLC;x 6;75 cl
3175;CDV095017;AC CHABLIS DME FILLON;2013;BLC;x 1;B10L
3176;208001H;AOP LANGUEDOC LA DAME;2012;RGE;x 6;75 cl
3177;208002H;IGP DES COTEAUX DE MURVIEL LA DIVA;2012;RGE;x 6;75 cl
3178;208003H;IGP D'OC GRENACHE;2013;BLC;x 6;75 cl
3179;178009H;IGP SAUVIGNON DME CASTELNAU;2015;BLC;x 6;75 cl
3180;CDV199010;IGPOC L' AUTRE VERSANT BEBIAN;2011;RGE;x 6;75 cl
3182;099013;IGP PAYS D'OC MUSCAT MOELLEUX DOUCEUR DU SUD;2016;BLC;x 6;75 cl
3183;CDV049027;AC BORDEAUX SUPERIEUR LAUDUC SUPERIEUR;2010;RGE;x 6;150 cl
3184;CDH-052100;AC PAUILLAC CH PICHON LONGUEVILLE BARON;2009;RGE;x 6;75 cl
3185;CDH-073105;AOP SAINT-JULIEN CH DUCRU BEAUCAILLOU;2009;RGE;x 6;75 cl
3186;169003CB;AOP COTES DE CASTILLON HARMONIE;2010;RGE;x 6;75 cl
3187;CDH-178003;IGP OC SYRAH CASTELNAU;0;RGE;x 6;75 cl
3188;CDV011010;AOP VOUVRAY TRANQUILLE CLOS LA LANTERNE SEC DME CH;2014;BLC;x 6;75 cl
3189;CDH-156002;VIN CHAUD CANON DES NEIGES;0;RGE;x 1;B03L
3190;CDH-156003;VIN CHAUD CANON DES NEIGES;0;RGE;x 1;B10L
3191;178015H;IGP PAYS D'OC L'EPICERIE DE CASTELNAU (bouchon);2014;RGE;x 6;75 cl
3192;CDH-178001;IGP D'OC CHARDONNAY;2013;BLC;x 6;75 cl
3193;199006;IGP DE L'HERAULT L'AUTRE VERSANT;2011;RGE;x 6;75 cl
3194;199005;AC COTEAUX DU LANGUEDOC PRIEURE ST JEAN;2013;BLC;x 6;75 cl
3195;199002;AC COTEAUX DU LANGUEDOC PRIEURE ST JEAN;2011;RGE;x 6;75 cl
3196;187002H;IGP DES CEVENNES;0;RSE;x 1;B05L
3197;187003H;IGP DES CEVENNES;0;BLC;x 1;B05L
3198;002037;AOP COSTIERES DE NIMES COMBES DE MEZIERES;2014;RGE;x 6;150 cl
3199;118077;ARMAGNAC RECOLTE 1993 ARIANE;1993;RGE;x 6;50 cl
3200;041016;AOP SAINT- ESTEPHE CH LES HAUTS DE PEZ;2012;RGE;x 6;75 cl
3201;CDH-001036;AC CHAMPAGNE BRUT SELECTION;0;BLC;x 1;Mathusalem
3202;002038;IGP GARD;0;BLC;x 1;B10L
3203;002039;IGP GARD;0;BLC;x 1;B05L
3204;049014;AC ENTRE DEUX MER CH FLAMAND BELLEVUE;2014;BLC;x 6;75 cl
3205;CDH-157005;IGP VALLEE DE LA LOIRE SAUVIGNON DOMAINE DE LA FOL;0;BLC;x 6;75 cl
3206;174020;(x4) AOP COTEAUX DU LANGUEDOC GARUS;0;RGE;x 4;B05L
3207;202010;VIN DE FRANCE ROSE FRUITE LOUERION;2014;RSE;x 1;B05L
3208;202015;AOP LUBERON LOUERION;2014;RGE;x 1;B05L
3209;219001H;AOP COTEAUX D'AIX EN PROVENCE LES VIGNERONS DU MIS;2014;RSE;x 1;B05L
3210;048003B;AC PUISSEGUIN ST EMILION;2012;RGE;x 6;75 cl
3217;220007H;IGP GAMAY COMTE TOLOSAN - CAVE DE LA BASTIDE;0;RGE;x 1;B05L
3221;220020H;IGP COMTE TOLOSAN - LEO & CO;2014;RGE;x 6;75 cl
3222;220021H;IGP COMTE TOLOSAN - LEO & CO;2015;RSE;x 6;75 cl
3223;220022H;IGP COMTE TOLOSAN - LEO & CO;2015;BLC;x 6;75 cl
3229;220028H;AOP GAILLAC - HOMMAGE A LA TRUFFE;2014;RGE;x 6;75 cl
3230;220029H;AOP GAILLAC - HOMMAGE A LA TRUFFE;2012;BLC;x 6;75 cl
3233;174003;IGP CARIGNAN - PETIT LOUP;2014;RGE;x 6;75 cl
3234;221001H;AOP IROULEGUY DOMAINE MOURGUY;2013;RGE;x 6;75 cl
3236;160004H;AOP COTES DU RHONE DME LACOSTE DUPUY;2013;RGE;x 6;75 cl
3237;204008H;IGP VIOGNIER DME DU BON REMEDE;2014;BLC;x 6;75 cl
3238;201026;IGP VAUCLUSE BALLADE DE COLLINE;2014;RGE;x 6;75 cl
3239;201027;IGP VAUCLUSE BALLADE DE COLLINE;2014;RSE;x 6;75 cl
3240;143003;AC COTEAUX DU GIENNOIS CUVEE CHICAGO;2014;RGE;x 6;75 cl
3241;049009;AC BORDEAUX CHATEAU LAUDUC;2014;RSE;x 6;75 cl
3242;CDH-556007;VIN DE PORTO;0;RSE;x 6;75 cl
3243;CDV049023;AC BORDEAUX FLAMAND BELLEVUE;2013;RGE;x 12;37.5 cl
3244;052323;CH GUILLEMIN GAFFELIERE AC ST EMILION GRAND CRU;2010;RGE;x 6;75 cl
3245;222001H;CHATEAU-CHALON - VIN JAUNE - DME GRAND;2008;BLC;x 6;70 cl
3246;222002H;COTES DU JURA - PINOT NOIR - DME GRAND;2013;RGE;x 6;75 cl
3247;222003H;COTES DU JURA - TROUSSEAU - DME GRAND;2014;RGE;x 6;75 cl
3248;222004H;COTES DU JURA - CHARDONNAY - DME GRAND;2013;BLC;x 6;75 cl
3249;222005H;COTES DU JURA - SAVAGNIN - DME GRAND;0;BLC;x 6;75 cl
3250;223001H;AOP CORNAS - DOM JOHANN MICHEL;2014;RGE;x 6 CB;75 cl
3251;202007;VDF ROSE FRUITE MUSCAT DE HAMBOURG;2013;RSE;x 6;75 cl
3252;CDV002903;IGP OC MERLOT;0;RGE;x 1;B20L
3253;CDH-196001;BARRIOBERO JOVEN RIOJA;0;RGE;x 6;75 cl
3254;035014;AC SAINT NICOLAS DE BOURGUEIL;2012;RGE;x 3;150 cl
3255;171003H;AOP COTES DU RHONE DOMAINE CABOTTE;0;BLC;x 6;75 cl
3256;002040;AOP COSTIERES DE NIMES PRESTIGE;2015;RGE;x 6;75 cl
3257;224001H;AOP COTEAUX DU LYONNAIS - DOM. PETIT FROMENTIN;0;RGE;x 1;B10L
3258;224002H;AOP COTEAUX DU LYONNAIS - DOM. PETIT FROMENTIN;0;RGE;x 1;B05L
3259;224003H;AOP COTEAUX DU LYONNAIS - DOM. PETIT FROMENTIN;2013;RGE;x 6;75 cl
3261;225001H;AOP SAVENNIERES - CROIX PICOT - DOM. FL;2012;BLC;x 6;75 cl
3263;CDH-220005;AOP COTES DU JURA SAVAGNIN DME GRAND;2012;RGE;x 6;75 cl
3264;CDH-220004;AOP COTES DU JURA CHARDONNAY DME GRAND;2012;BLC;x 6;75 cl
3265;CDH-220002;AOP COTES DU JURA PINOT NOIR DME GRAND;2013;RGE;x 6;75 cl
3266;CDH-220003;AOP COTES DU JURA TROUSSEAU DME GRAND;2013;RGE;x 6;75 cl
3267;CDV169012;AOP BORDEAUX CH MESSAYA;0;RGE;x 12 CB;37.5 cl
3268;CDH-801009;AOP HAUTES COTES DE BEAUNE DME FRANCOIS CHARLES;2014;RGE;x 3 CB;150 cl
3269;202008;MUSCAT - PETITS GRAINS - LOUERION;2014;BLC;x 6;75 cl
3270;202012;AOP LUBERON - TERRARMONIE - LOUERION;2013;RGE;x 6;75 cl
3271;202013;AOP LUBERON - TERRARMONIE - LOUERION;2013;RSE;x 6;75 cl
3272;CDV096007;AC GRAVES CHATEAU DE L'HOSPITAL;2009;RGE;x 6;150 cl
3273;153006;AC PETIT CHABLIS;2014;BLC;x 6;75 cl
3274;227001H;IGP PAYS D'OC MOURVEDRE LES JAMELLES;2013;RGE;x 6;75 cl
3275;227002H;IGP PAYS D'OC SYRAH LES JAMELLES;2014;RGE;x 6;75 cl
3276;227003H;IGP PAYS D'OC PINOT NOIR LES JAMELLES;2013;RGE;x 6;75 cl
3277;227004H;IGP PAYS D'OC CHARDONNAY LES JAMELLES;2014;BLC;x 6;75 cl
3278;227005H;IGP PAYS D'OC VIOGNIER LES JAMELLES;2013;BLC;x 6;75 cl
3279;227010H;IGP PAYS D'OC MERLOT (BIO) LES JAMELLES BIO;2014;RGE;x 6;75 cl
3280;227011H;IGP PAYS D'OC CHARDONNAY (BIO) LES JAMELLES BIO;2014;BLC;x 6;75 cl
3281;CDH-225001;AOP SAVENNIERES CROIX PICOT DOMAINE FL;2012;BLC;x 6;75 cl
3282;CDH-049027;AOP BORDEAUX SUP CH LAUDUC;2003;RGE;x 6;150 cl
3283;CDV002021;AOP COSTIERES DE NIMES CUVEE PRESTIGE;2011;BLC;x 6;75 cl
3284;CDH-561003;AC MARGAUX CH RAUZAN GASSIE;2009;RGE;x 12 CB;75 cl
3286;220009H;IGP SAUVIGNON COMTE TOLOSAN - CAVE DE LA BASTIDE;2014;BLC;x 1;B05L
3287;041001/10;AC ST ESTEPHE CH TOUR DE PEZ;2010;RGE;x 6;75 cl
3288;CDV041001/09;AC SAINT-ESTEPHE CH TOUR DE PEZ CAISSE BOIS;2009;RGE;x 6;75 cl
3289;CDH-222001;AOP CHATEAU CHALON - VIN JAUNE - DME GRAND BLANC;2007;BLC;x 6;62 cl
3291;137004;IGP PAYS D'OC MAS DES CABRES;2014;BLC;x 6;75 cl
3292;CDH-188003;AOP TAVEL DME CORNELOUP;2014;RSE;x 12 CB;37.5 cl
3293;094004;AOP MOULIS EN MEDOC CH GRANINS GD POUJEAUX;2012;RGE;x 6;75 cl
3294;154003H;AOP MERCUREY DME DE SUREMAIN;2013;BLC;x 6;75 cl
3295;228001H;AOP  LE BLANC DME TURNER PAGEOT;2013;BLC;x 6;75 cl
3296;228002H;AOP LANGUEDOC LE ROUGE TURNER PAGEOT;2012;RGE;x 6;75 cl
3298;CDV175002;AOP CHEVERNY DME MAISON PERE & FILS;2010;RGE;x 6;75 cl
3299;227006H;IGP PAYS D'OC MALBEC LES JAMELLES;0;RGE;x 6;75 cl
3300;227007H;IGP PAYS D'OC CARIGNAN LES JAMELLES;0;RGE;x 6;75 cl
3301;CDH-178002;IGP D OC VIOGNIER CASTELNAU;2014;BLC;x 6;75 cl
3302;CDH-801008;AOP¨BEAUNE 1ER CRU LES BOUCHEROTTES;2010;RGE;x 6;75 cl
3303;012008H;DME CP-GALHAN VDP DUCHE D'UZES AMANLIE;2014;BLC;x 6;75 cl
3304;178016H;IGP PAYS D'OC L'EPICERIE DE CASTELNAU (bouchon);2014;RSE;x 6;75 cl
3305;178017H;IGP PAYS D'OC L'EPICERIE DE CASTELNAU (bouchon);2014;BLC;x 6;75 cl
3306;210004H;AOP MINERVOIS GRANDE RESERVE DME PUJOL-IZARD;2012;RGE;x 6;75 cl
3307;214002H;"IGP COMTE TOLOSAN MERLOT TANNAT ""ETC"" Vign du Quer";2014;RGE;x 6;75 cl
3308;CDV002014;VDT C. GALLICIAN;0;RSE;x 1;B10L
3309;CDV002036;IGP D'OC MERLOT - CARTON GALLICIAN;0;RGE;x 1;B10L
3310;CDV059025;IGP MEDITERRANEE TERES;2014;RSE;x 6;75 cl
3313;036008;IGP SAINT GUILHEM LE DESERT GRENACHE;2014;BLC;x 1;B10L
3314;036030;IGP SAINT GUILHEM LE DESERT GRENACHE;2014;BLC;x 6;75 cl
3315;CDH-204003;VENTOUX;0;RSE;x 1;B10L
3316;CDH-204004;VENTOUX;1990;RSE;x 1;B05L
3317;CDH-204002;VENTOUX;1990;RGE;x 1;B05L
3318;212002;AOP CAHORS CUVEE MYTHIQUE;0;RGE;x 6;75 cl
3319;051010/11;CLOS TRIMOULET AC ST EMILION GD CRU;2012;RGE;x 6;75 cl
3321;164005/12;AC ST EMILION GD CRU CH JUCALIS;2012;RGE;x 6;75 cl
3322;CDV095011;DOMAINE FILLON AC CHABLIS VIEILLE VIGNES;2011;BLC;x 6;75 cl
3324;119005;MINERVOIS DOMAINE DES HOMS;2013;RGE;x 6;150 cl
3325;CDV052046;CLOS DE RAMAGE AC HAUT MEDOC;2005;RGE;x 6;150 cl
3327;070002H;EL GRANO CARMENERE VIN DU CHILI;2015;RGE;x 6;75 cl
3331;196001H;SENORIO BARIOBERO JOVEN DE RIOJA;2015;RGE;x 12 CB;75 cl
3332;563001H;AC POMEROL BEAU SOLEIL;2012;RGE;x 6;75 cl
3333;070015H;EL PODA CORTA VIN DU CHILI;2011;RGE;x 6;75 cl
3334;212002H;AOP CAHORS CUVEE MYTHIQUE;2011;RGE;x 6;75 cl
3335;CDV114006;GAMAY TOURAINE DE LA CHAISE;2013;RGE;x 12 CB;37.5 cl
3336;CDH-187011;IGP CEVENNES CAVE DE TORNAC;2014;RGE;x 1;B10L
3337;CDH-171003;AOP COTES DU RHONE DOMAINE CABOTTE;0;BLC;x 6;75 cl
3338;191005H;AC VIN DE SAVOIE ABYMES CH DE LA VIOLETTE;2014;BLC;x 6;75 cl
3339;CDH-564001;AOC MARGAUX AURORE DE DAUZAC;2013;RGE;x 6;75 cl
3340;CDH-564002;AOC PAUILLAC RESERVE DE LA COMTESSE;2007;RGE;x 6;75 cl
3341;CDH-564003;AOC ST ESTEPHE LA CHAPELLE DE CALON;2011;RGE;x 6;75 cl
3342;CDH-564004;AOC ST JULIEN AMIRAL DE BEYCHEVELLE;2011;RGE;x 6;75 cl
3343;CDH-564005;AOC MARGAUX LA SIRENE DE GISCOURS;2006;RGE;x 12 CB;75 cl
3344;226001;AOP BLANQUETTE LIMOUX PREM. BULLES;0;BLC;x 6;75 cl
3345;229001;AOP BEAUJOLAIS NOUVEAU DME DU BOIS DU JOUR;2016;RGE;x 6;75 cl
3346;229002;AOP BEAUJOLAIS NOUVEAU DME DU BOIS DU JOUR;2016;RGE;x 1;B10L
3347;229003;AOP BEAUJOLAIS NOUVEAU DME DU BOIS DU JOUR;2016;RGE;x 1;B05L
3348;229005;AOP BEAUJOLAIS DME DU BOIS DU JOUR;2014;BLC;x 6;75 cl
3349;229006;AOP BOURGOGNE DME DU BOIS DU JOUR;2015;BLC;x 6;75 cl
3350;229007;AOP BEAUJOLAIS VIEILLES VIGNES DME DU BOIS DU JOUR;2013;RGE;x 6;75 cl
3351;229008;AOP COTEAUX BOURGUIGNON DME DU BOIS DU JOUR;2014;RGE;x 6;75 cl
3352;CDH-171002;CABOTTE CUVEE YVONNE;2009;RGE;x 6;75 cl
3353;CDH-805004;GEVREY CHAMBERTIN 1ER CRU LES FONTENYS;2012;RGE;x 6;75 cl
3354;201900;AOP COTES DU RHONE PRIMEUR MAGIE D'UNE TERRE;2015;RGE;x 6;75 cl
3355;052600;CH LA NERE AOP LOUPIAC;2005;BLC;x 6;75 cl
3356;074200;AOP GIGONDAS LE BRUT DE FOUDRE;2012;RGE;x 4;150 cl
3357;074201;AOP VACQUEYRAS BEAUMIRAIL CAISSE BOIS;2012;RGE;x 4;150 cl
3358;074202;AOP BEAUMES DE VENISE TERRISSIMO CAISSE BOIS;2014;RGE;x 4;150 cl
3359;074203;AOP VACQUEYRAS LES PRIMAIRES;2012;RGE;x 6;75 cl
3360;074204;AOP GIGONDAS LA REFERENCE;2010;RGE;x 6;75 cl
3361;CDH-230001;AOP ST ROMAIN BLC DME BOUT MONDE;2012;BLC;x 12 CB;75 cl
3362;CDH-230002;AOP ST AUBIN BLC 1ER CRU DME MEIX;2014;BLC;x 6 CB;75 cl
3364;CDH-230003;AOP ST AUBIN RGE 1ER CRU DME MEIX;2013;RGE;x 6 CB;75 cl
3365;201028;IGP VIOGNIER  BALLADE DE COLLINE;2014;BLC;x 6;75 cl
3366;229004;AOP BEAUJOLAIS NOUVEAU DME DU BOIS DU JOUR;2015;RSE;x 6;75 cl
3367;229009;AOP COTEAUX BOURGUIGNON DME DU BOIS DU JOUR;2014;RGE;x 6;150 cl
3368;229020;AOP CREMANT DE BOURGOGNE DME BOIS DU JOUR;2015;BLC;x 6;75 cl
3369;229021;ECLAT DE ROSE DME BOIS DU JOUR;0;RSE;x 6;75 cl
3370;CDH-801005;"VOLNAY 1ER CRU ""FREMIETS""";2012;RGE;x 6;75 cl
3371;012002H;IGP CEVENNES LES FRIGOULIERS DME CAMP GALHAN;2014;RGE;x 6;75 cl
3372;012003H;IGP CEVENNES LES FRIGOULIERS DME CAMP GALHAN;2014;BLC;x 6;75 cl
3373;012010H;AOP DUCHE D'UZES LES PERRASSIERES DME CAMP GALHAN;0;RGE;x 6;75 cl
3374;CDH-222004;AOP COTES DU JURA CHARDONNAY;2012;BLC;x 6;75 cl
3375;100002H;COTES ROTIES CEDRIC PARPETTE;0;RGE;x 6;75 cl
3376;CDV162005;JOUCLARY CUVEE GUILLAUME;2012;RGE;x 6;75 cl
3377;CDV162006;JOUCLARY CUVEE GUILLAUME;1990;RGE;x 6;150 cl
3378;CDV025041;AOP LIMOUX LAS GRAVAS;2013;BLC;x 6;75 cl
3379;153012;BOURGOGNE EPINEUIL PINOT NOIR GARNIER;2014;RGE;x 6;75 cl
3380;CDV010051;AOP VOUVRAY MOELLEUX GAILLARD;0;BLC;x 6;75 cl
