ID;Reference;Designation;Mill;Coul;Cond;Cont
1031;071015;MONTAUD SAUVIGNON VDPOC 13;0;BLC;x 1;VRAC
1032;071016;MONTAUD AC COTEAUX DU LANGUEDOC;0;RGE;x 1;VRAC
1033;071020;SUSSARGUES VDT 12;0;RSE;x 1;VRAC
1034;006001;DOM GRANGE AC MUS SEVRE MAINE / LIE CUV DOMAINE;0;BLC;x 12;75 cl
1035;006002;DOM GRANGE AC MUS SEVRE MAINE / LIE CUV DOMAINE;0;BLC;x 24;37.5 cl
1036;006007;CLOS DES ALLEES  AC MUS SEVRE MAINE / LIE;0;BLC;x 12;75 cl
1037;006008;CLOS DES ALLEES  AC MUS SEVRE MAINE / LIE;0;BLC;x 24;37.5 cl
1038;006010;"LE ""L"" D'OR DE LUNEAU AC MUS SEVRE MAINE / LIE";0;BLC;x 12;75 cl
1039;006011;"LE ""L"" D'OR DE LUNEAU AC MUS SEVRE MAINE / LIE";0;BLC;x 24;37.5 cl
1040;006013;MANOIR LUNEAU PAPIN MUSCADET S*M / LIE FUT CHENE;0;BLC;x 12;75 cl
1041;006014;MANOIR GRANGE MUSCADET S*M / LIE FUT CHENE NEUF;0;BLC;x 24;37.5 cl
1042;006023;LES PIERRES BLANCHES AC MUSCADET S* M / LIE;0;BLC;x 12;75 cl
1043;006024;LES PIERRES BLANCHES AC MUSCADET S* M / LIE;0;BLC;x 24;37.5 cl
1044;006509;L D'OR DE LUNEAU AC MUSCADET S*M / LIE;0;BLC;x 12;75 cl
1045;064001;DOM DU CLOSEL AC SAVENNIERES LA JALOUSIE;2002;BLC;x 12;75 cl
1046;064002;DOM DU CLOSEL AC SAVENNIERES CUVEE CLASSIQUE;2001;BLC;x 24;37.5 cl
1047;064007;DOM DU CLOSEL AC SAVENNIERES CUVEE SPECIALE;0;BLC;x 12;75 cl
1048;061020;LAVILLEDIEU AOVDQS 11;0;RGE;x 1;B10L
1049;056001;DOMAINE DES OUCHES AC BOURGUEIL;0;RGE;x 12;75 cl
1050;056002;DOMAINE DES OUCHES AC BOURGUEIL;0;RGE;x 24;37.5 cl
1051;047001;Y. LAMBERT AC CREMANT DE LOIRE;0;BLC;x 6;75 cl
1052;047005;Y. LAMBERT AC SAUMUR LA COULEE DE ST CYR;2001;BLC;x 6;75 cl
1053;023001;JARNOTERIE AC ST NICOLAS DE BOURGUEIL;0;RGE;x 12;75 cl
1054;023002;JARNOTERIE AC ST NICOLAS DE BOURGUEIL;0;RGE;x 24;37.5 cl
1056;088002;DOMAINE PORTIER AC QUINCY;0;BLC;x 12;37.5 cl
1057;065001;DOMAINE DE L'OLIVETTE AC BANDOL;0;RSE;x 12;75 cl
1058;065002;DOMAINE DE L'OLIVETTE AC BANDOL;0;RSE;x 24;37.5 cl
1059;065003;DOMAINE DE L'OLIVETTE AC BANDOL;0;RGE;x 12;75 cl
1060;065005;DOMAINE DE L'OLIVETTE AC BANDOL;0;BLC;x 12;75 cl
1061;059001;CHAT ROUET AC COTES PROVENCE CUVEE RESERVEE;2005;RSE;x 12;75 cl
1062;059002;AC C.PROVENCE. ESTERELLE .ROUET;2015;RSE;x 12;37.5 cl
1063;059010;AC C.PROVENCE. BELLE POULE;2014;RSE;x 6;75 cl
1065;037001;JM. RAFFAULT AC CHINON LES PICASSES;0;RGE;x 6;75 cl
1066;037002;JM. RAFFAULT AC CHINON LES PICASSES;0;RGE;x 1;37.5 cl
1067;037005;JM. RAFFAULT AC CHINON;2014;RSE;x 6;75 cl
1068;037006;JM. RAFFAULT AC CHINON;0;RSE;x 1;37.5 cl
1069;037010;AC CHINON SEC;2015;BLC;x 6;75 cl
1070;037011;JM. RAFFAULT AC CHINON SEC;0;BLC;x 1;37.5 cl
1071;009001;LES CHAILLOUX AC POUILLY FUME;2003;BLC;x 6;75 cl
1072;009002;LES CHAILLOUX AC POUILLY FUME;2003;BLC;x 12;37.5 cl
1073;009004;DOM CHAT AC POUILLY FUME LES CHARMES;0;BLC;x 12;75 cl
1074;009005;DOM CHAT AC POUILLY FUME LES CHARMES;0;BLC;x 24;37.5 cl
1075;009007;DOM CHAT AC POUILLY FUME CHATELAIN PRESTIGE;0;BLC;x 12;75 cl
1076;068001;"DUBREUIL FON AC PERNAND VERGELESSES ""CLOS BERTHET""";0;BLC;x 6;75 cl
1077;068002;"DUBREUIL FON AC PERNAND VERGELESSES ""CLOS BERTHET""";0;RGE;x 12;75 cl
1078;068003;DUBREUIL F. AC PERNAND ILE DES VERGELESSES 1ER CRU;2002;BLC;x 6;75 cl
1079;068013;DUB. F. AC SAVIGNY LES BEAUNE VERGELESSES 1ER CRU;2003;BLC;x 6;75 cl
1080;068014;DUBREUIL F. AC PERNAND VERGELESSES;0;BLC;x 6;75 cl
1081;068015;DUBREUIL F. AC BEAUNE MONTREVENOTS 1ER CRU;0;BLC;x 6;75 cl
1082;068016;DUBREUIL F. AC ALOXE CORTON LES VERCOTS 1ER CRU (;2001;RGE;x 6;75 cl
1083;068030;DUBREUIL F. AC CORTON CLOS DU ROI GRAND CRU;0;RGE;x 6;75 cl
1084;068032;DUBREUIL F. AC CORTON PERRIERES GRAND CRU;0;RGE;x 6;75 cl
1085;068040;DUBREUIL F. AC VOLNAY;2001;RGE;x 6;75 cl
1086;068045;DUBREUIL F. AC POMMARD EPENOTS 1ER CRU;0;RGE;x 6;75 cl
1087;068106;DUBREUIL F. AC PERNAND VERGELESSES;0;BLC;x 6;75 cl
1088;068120;DUBREUIL F. AC CORTON CHARLEMAGNE GRAND CRU;0;BLC;x 6;75 cl
1089;068200;DUBREUIL F. AC BOURGOGNE ALIGOTE;0;BLC;x 12;75 cl
1090;013000;LA CHABLISIENNE AC BOURGOGNE PASSETOUTGRAINS;2004;RGE;x 6;75 cl
1091;013001;LA CHABLISIENNE AC BOURGOGNE PASSETOUTGRAINS;2001;RGE;x 12;37.5 cl
1092;013006;LA CHABLISIENNE VDP CHARDONNAY;0;BLC;x 6;75 cl
1093;013007;LA CHABLISIENNE VIN APP VILLAGE IRANCY;0;RGE;x 6;75 cl
1094;013010;LA CHAB.  AC CHABLIS 1ER CRU FOURCHAUME  VAULORENT;2002;BLC;x 6;75 cl
1095;013011;LA CHAB.  AC CHABLIS 1ER CRU FOURCHAUME  VAULORENT;0;BLC;x 24;37.5 cl
1096;013012;LA CHABLISIENNE AC CREMANT DE BOURGOGNE CUVEE BRUT;0;BLC;x 6;75 cl
1099;013045;LA CHAB.  AC CHABLIS 1ER CRU MONTEE DE TONNERRE;0;BLC;x 6;75 cl
1100;013046;LA CHAB.  AC CHABLIS 1ER CRU MONTEE DE TONNERRE;0;BLC;x 12;37.5 cl
1101;013055;LA CHABLISIENNE  AC PETIT CHABLIS;2004;BLC;x 6;75 cl
1102;013056;LA CHABLISIENNE  AC PETIT CHABLIS;0;BLC;x 6;150 cl
1103;013070;LA CHABLISIENNE  AC CHABLIS CUVEE LC;0;BLC;x 12;75 cl
1104;013071;LA CHABLISIENNE  AC CHABLIS CUVEE LC;0;BLC;x 6;75 cl
1105;013072;LA CHABLISIENNE  AC CHABLIS CUVEE LC;0;BLC;x 12;37.5 cl
1106;013073;LA CHABLISIENNE  AC CHABLIS CUVEE LC;0;BLC;x 6;75 cl
1107;013074;LA CHABLISIENNE  AC CHABLIS CUVEE LC;0;BLC;x 1;150 cl
1108;013080;LA CHABLISIENNE  AC CHABLIS VIEILLES VIGNES;2001;BLC;x 6;75 cl
1109;013081;LA CHABLISIENNE  AC CHABLIS VIEILLES VIGNES;2001;BLC;x 12;37.5 cl
1110;013084;LA CHABLISIENNE  AC CHABLIS VIEILLES VIGNES;2002;BLC;x 6;75 cl
1112;013086;LA CHABLISIENNE  AC CHABLIS VIEILLES VIGNES;0;BLC;x 12;37.5 cl
1113;013087;LA CHABLISIENNE  AC CHABLIS VIEILLES VIGNES;0;BLC;x 6;75 cl
1114;013088;LA CHABLISIENNE  AC CHABLIS VIEILLES VIGNES;0;BLC;x 1;150 cl
1116;013132;LA CHABLISIENNE  AC CHABLIS GRAND CRU LES PREUSES;0;BLC;x 12;37.5 cl
1117;013160;LA CHABLISIENNE  AC CHABLIS GRAND CRU BOUGROS;0;BLC;x 12;75 cl
1118;013190;LA CHABLISIENNE  AC CHABLIS GRAND CRU BLANCHOT;0;BLC;x 12;75 cl
1119;013191;LA CHABLISIENNE  AC CHABLIS GRAND CRU BLANCHOT;0;BLC;x 12;37.5 cl
1120;013210;LA CHABLISIENNE  AC CHABLIS GRAND CRU VALMUR;0;BLC;x 12;75 cl
1121;013240;LA CHABLISIENNE  AC CHABLIS 1ER CRUCOTE DE LECHET;0;BLC;x 6;75 cl
1122;013271;LA CHABLISIENNE  AC CHABLIS GRAND CRU VAUDESIR;0;BLC;x 6;75 cl
1123;013272;LA CHABLISIENNE  AC CHABLIS GRAND CRU VAUDESIR;0;BLC;x 12;37.5 cl
1124;013300;LA CHABLISIENNE  AC CHABLIS GRAND CRU LES CLOTS;0;BLC;x 12;75 cl
1125;013330;LA CHABLISIENNE  AC CHABLIS GRAND CRU CH GRENOUILL;0;BLC;x 12;75 cl
1126;013331;LA CHABLISIENNE  AC CHABLIS GRAND CRU CH GRENOUILL;0;BLC;x 12;37.5 cl
1127;013332;LA CHABLISIENNE  AC CHABLIS GRAND CRU CH GRENOUILL;0;BLC;x 6;75 cl
1128;013345;LA CHABLISIENNE  AC CHABLIS 1ER CRU LES LYS;0;BLC;x 6;75 cl
1130;013361;LA CHABLISIENNE  AC CHABLIS 1ER CRU MONT DE MILIEU;2003;BLC;x 12;37.5 cl
1131;013362;LA CHABLISIENNE  AC CHABLIS 1ER CRU MONT DE MILIEU;2003;BLC;x 6;75 cl
1132;013363;LA CHABLISIENNE  AC CHABLIS 1ER CRU MONT DE MILIEU;0;BLC;x 1;150 cl
1133;013392;LA CHABLISIENNE  AC CHABLIS 1ER CRU BEAUROY;0;BLC;x 12;75 cl
1134;013420;LA CHABLISIENNE  AC CHABLIS 1ER CRU VAILLONS;0;BLC;x 12;75 cl
1135;013450;LA CHABLISIENNE  AC CHABLIS 1ER CRU MONTMAIN;0;BLC;x 12;75 cl
1136;013480;LA CHABLISIENNE  AC CHABLIS 1ER CRU FOURCHAUME;2001;BLC;x 12;75 cl
1137;013481;LA CHABLISIENNE  AC CHABLIS 1ER CRU FOURCHAUME;2000;BLC;x 24;37.5 cl
1138;013483;LA CHAB.  AC CHABLIS 1ER CRU FOURCHAUME VAULORENTS;0;BLC;x 12;75 cl
1139;013540;LA CHAB.  AC CHABLIS 1ER CRU MONTEE DE TONNERRE;0;BLC;x 6;75 cl
1140;013660;LA CHABLISIENNE  AC CHABLIS GRAND CRU GRENOUILLE;0;BLC;x 6;75 cl
1141;013661;LA CHABLISIENNE  AC CHABLIS GRAND CRU GRENOUILLE;0;BLC;x 24;37.5 cl
1142;004001;DOM DOZON AC CHINON CLOS SAUT LOUP;2002;RGE;x 6;75 cl
1143;004002;DOM DOZON AC CHINON CLOS SAUT LOUP;2002;RGE;x 12;37.5 cl
1144;004004;DOM DOZON AC CHINON;0;RSE;x 6;75 cl
1145;004005;DOM DOZON AC CHINON;0;RSE;x 12;37.5 cl
1147;004008;DOM DOZON AC CHINON VIEILLES VIGNES;2003;RGE;x 12;37.5 cl
1148;004009;DOM DOZON AC CHINON VIEILLES VIGNES;0;RGE;x 3;150 cl
1150;019011;AC BX SUP. CH GAURY-BALETTE;2014;RGE;x 6;75 cl
1151;025026;VDP CHARDONNAY. D.D'ANTUGNAC;2014;BLC;x 6;75 cl
1153;042100;IGP VAUCLUSE;0;RGE;x 1;VRAC
1156;032001;CH PEY-LAMOTHE TRADITION AC ST EMILION;2001;RGE;x 6;75 cl
1158;040012;AC C DE BOURG BEL AIR;2012;RGE;x 6;150 cl
1159;052039;AC HT-MEDOC ENCLOS DE RAMAGE;2010;RGE;x 6;75 cl
1160;015001;CHATEAU DE LA NAUVE AC ST EMILION;2000;RGE;x 6;75 cl
1161;015005;CHATEAU DE LA NAUVE AC ST EMILION FUT DE CHENE;2001;RGE;x 6;75 cl
1162;074001;AC GIGONDAS SIGNATURE;2088;RGE;x 6;75 cl
1163;074005;HALLALI - GRANDE RESERVE AC GIGONDAS;2006;RGE;x 6;75 cl
1165;025002;AC SAINT VERAN;2010;BLC;x 24;37.5 cl
1169;075001;AC MEDOC CH LE BREUIL RENAISSANCE;2004;RGE;x 6;75 cl
1177;032005;CH PEY LAMOTHE LA REFERENCE AC MONTAGNE ST EMILION;2000;RGE;x 6;75 cl
1185;051010;CLOS TRIMOULET AC ST EMILION GD CRU;2010;RGE;x 6;75 cl
1188;061001;AOVDQS LAVILLEDIEU 11;2003;RGE;x 1;B10L
1189;035016;DOM OLIVIER AC ST NICOLAS DE BOURGUEIL;2002;RGE;x 1;300cl D-MAG
1193;052017;AC HT MEDOC CRU B CH RAMAGE LA BATISSE;2010;RGE;x 6;150 cl
1194;052038;CLOS DE RAMAGE AC HAUT-MEDOC;1999;RGE;x 6;75 cl
1195;071005;BOISSERON MERLOT VDT 12;0;RGE;x 1;VRAC
1196;025021;AC POUILLY-FUISSE. V.VIGNES;2013;BLC;x 6;75 cl
1197;076001;CHATEAU LA BONETIE AC BORDEAUX;2001;RGE;x 6;75 cl
1198;076005;CHATEAU LA BONETIE AC ENTRE DEUX MERS;2004;BLC;x 6;75 cl
1203;114007;AC TOURAINE D.LA CHAISE;2003;RSE;x 6;75 cl
1204;114008;DOMAINE DE LA CHAISE AC TOURAINE;2003;RSE;x 6;37.5 cl
1207;057015;DME BELLEFOND AOC GAILLAC;2002;RGE;x 6;75 cl
1208;011015;AC VOUVRAY METH TRAD BRUT D.CHATAIGNERAIE;0;BLC;x 6;150 cl
1209;017030;DOMAINE BELLEGARDE AC JURANCON MOELLEUX;2003;BLC;x 12;75 cl
1210;013002;DME LA CHABLISIENNE AC PETIT CHABLIS PRELUDE;2002;BLC;x 6;75 cl
1211;063089;CH NODOZ  T. B.  AC COTES DE BOURG;0;RGE;x 24;37.5 cl
1212;086020;DUC DE BERTICOT AC COTES DE DURAS;2001;RGE;x 6;75 cl
1213;086021;CUVEE VIEILLES VIGNES AC COTES DE DURAS SAUVIGNON;2001;BLC;x 6;75 cl
1214;025008;DME DEUX ROCHES AC SAINT VERAN LES TERRES NOIRES;2002;BLC;x 6;75 cl
1215;025007;DME DEUX ROCHES AC SAINT VERAN VIEILLES VIGNES;2002;BLC;x 6;75 cl
1216;032002;CH PEY-LAMOTHE TRADITION AC MONTAGNE ST EMILION;2002;RGE;x 6;75 cl
1217;075002;AC MEDOC. CH.BREUIL RENAISSANCE;2013;RGE;x 6;75 cl
1220;090005;DOMAINE ST ENNEMOND BROUILLY;2002;RGE;x 6;75 cl
1221;090006;DOMAINE ST ENNEMOND BROUILLY;2002;RGE;x 6;37.5 cl
1222;090021;DOMAINE SANTE AC MOULIN A VENT;2002;RGE;x 6;75 cl
1223;090030;CHRISTIAN BERNARD AC FLEURIE;2002;RGE;x 6;75 cl
1224;090031;CHRISTIAN BERNARD AC FLEURIE;2002;RGE;x 6;37.5 cl
1225;040009CB;AC C.DE BOURG. BEL AIR;2011;RGE;x 3 CB;75 cl
1226;019002;CH LES HAUTS DE PEREY AC BDX SUP;2003;RGE;x 6;75 cl
1227;007007;DME DUSSOURT AC RIESLING;2001;BLC;x 6;75 cl
1228;042024;SCEAU DU PRINCE AC COTES DU RHONE;2003;RGE;x 6;75 cl
1229;042027;SCEAU DU PRINCE AC COTES DU RHONE;2003;RGE;x 12;37.5 cl
1230;042098;BLASON DU PRINCE AC CHATEAU NEUF DU PAPE;2003;RGE;x 6;75 cl
1231;028004;CH LES BERTRANDS AC 1ERES COTES DE BLAYE TRAD;2003;BLC;x 6;75 cl
1232;029011;DME BELLE MARE VDP COLLINES DE LA MOURE;2003;RGE;x 6;75 cl
1233;026700;VIGN S-BEL AC COTEAUX DU LYONNAIS;0;RSE;x 1;B10L
1234;089800;AC SAUMUR BRUT D.DE LA PALEINE;0;RSE;x 6;75 cl
1235;007008;AC RIESLING D. DUSSOURT;2011;BLC;x 12;37.5 cl
1236;062023;AC GRAVES .PRESTIGE C.D'ARTIGUES;2005;RGE;x 6;75 cl
1238;063092;CH NODOZ COTES DE BOURG;1990;RGE;x 6;150 cl
1239;071900;VDT ROUGE 12 DEGRES CUVEE DES GOURMETS;2003;RGE;x 1;VRAC
1240;071910;VDP OC MERLOT ROUGE 12 ;2003;RGE;x 6;VRAC
1241;071916;VDP ROUGE MERLOT 12 DOMAINE LANDAU;2003;RGE;x 6;VRAC
1242;006025;DOM GRANGE VDP JARDIN DE LA FRANCE GAMAY;2003;RGE;x 6;75 cl
1243;031078;SAUMUR CHAMPIGNY CUV BAUNELLES DME BOIS JOLI;2003;RGE;x 6;75 cl
1244;031079;SAUMUR CHAMPIGNY CUV BAUNELLES DME BOIS JOLI;2003;RGE;x 6;37.5 cl
1245;087003;GERARD BIGONNEAU AC REUILLY BLANC LES BOUCHAUDS;2003;BLC;x 6;75 cl
1246;087010;AOC QUINCY DME CHAGNAT;2003;BLC;x 6;75 cl
1247;087011;GERARD BIGONNEAU QUINCY;2003;BLC;x 6;37.5 cl
1248;011016;CUVEE 23 OCTOBRE AC VOUVRAY MOELLEUX 50 CL;2003;BLC;x 6;75 cl
1249;019012;AC BDX SUP. CH GAURY BALETTE;2005;RGE;x 6;150 cl
1250;025020;DME 2 ROCHES POUILLY FUISSE;2003;BLC;x 24;37.5 cl
1251;090017;DME PRESSOIR FLEURI AC MORGON A.MEZIAT;2003;RGE;x 6;75 cl
1252;076004;CH LA BONETIE AC BORDEAUX;2000;RGE;x 6;75 cl
1253;071918;VDP OC RGE SYRAH 12;2003;RGE;x 6;VRAC
1254;027007;DME GD ROUVIERE  AC COTES DE PROVENCE ROSE;2004;RSE;x 1;B10L
1255;027008;DME GD ROUVIERE  AC COTES DE PROVENCE;2004;RSE;x 1;B05L
1256;071904;VIN DE TABLE ROUGE MERLOT;2003;RGE;x 1;VRAC
1257;071913;VIN DE TABLE ROUGE 12;2003;RGE;x 1;VRAC
1258;042902;VDP VAUCLUSE ROUGE;2003;RGE;x 1;VRAC
1259;071915;VDT ROSE 12;2003;RGE;x 1;VRAC
1260;020001;CH DE LA COUR AV ST EMILION 98;1998;RGE;x 6;75 cl
1261;025028;VINS DES PERSONNETS VDPOC BLANC;2003;BLC;x 6;75 cl
1262;018190;BARONNIE D' AIGNAN BRUT ANTIQUE CREMANT DE LOIRE;0;BLC;x 6;75 cl
1263;033002;CLOS LABARDE ST EMILION GRAND CRU;2002;RGE;x 6;75 cl
1264;033003;CLOS LABARDE ST EMILION GRAND CRU;2002;RGE;x 6;37.5 cl
1265;005020;CH PASSAVANT ANJOU VILLAGE RGE;0;RGE;x 6;37.5 cl
1266;005019;CH PASSAVANT ANJOU VILLAGE RGE;0;RGE;x 6;75 cl
1267;090018;DME MEZIAT AC MORGON;0;RGE;x 6;37.5 cl
1268;064005;DME CLOSEL CLOS DU PAPILLON;0;BLC;x 6;75 cl
1269;090000;DME ROCHE ST MARTIN BROUILLY;0;RGE;x 6;75 cl
1270;090001;DME ROCHE ST MARTIN BROUILLY;0;RGE;x 6;75 cl
1271;090048;DME DU MOULIN BERGER AC ST AMOUR;0;RGE;x 6;75 cl
1272;090049;DME DU MOULIN BERGER AC ST AMOUR;0;RGE;x 6;37.5 cl
1273;013701;CHABLIS GD CRU GRENOUILLE;0;BLC;x 6;75 cl
1274;025011;DOM 2 ROCHES MACON VILLAGES;0;BLC;x 6;37.5 cl
1275;068020;DME DUBREUIL FONTAINE AC BOURG CHAPELLE NOTRE DAME;2002;RGE;x 6;75 cl
1276;013100;LA CHAB AC CHABLIS PREMIER CRU GRANDE CUVEE;2002;BLC;x 6;75 cl
1278;079003;DOMAINE CORNE LOUP TAVEL;2003;RGE;x 6;75 cl
1279;079002;DOMAINE CORNE LOUP TAVEL;2003;RGE;x 24;37.5 cl
1280;025035;VDPOC JEUNES VIGNES BLANC;0;BLC;x 6;75 cl
1281;025036;VDPOC JEUNES VIGNES ROUGE;0;RGE;x 6;75 cl
1282;093000;CH SEGONZAC AC 1ERE COTES DE BLAYE RGE;0;RGE;x 6;75 cl
1283;093003;CH SEGONZAC AC 1 ERE COTES DE BLAYE RGE;0;RGE;x 24;37.5 cl
1284;041007;CH TOUR DE PEZ AC ST ESTEPHE;2009;RGE;x 24;37.5 cl
1285;044002;VPOC CHARDONNAY D.DE CLAPIES;2007;BLC;x 6;75 cl
1286;013485;LA CHABLISIENNE  AC CHABLIS 1ER CRU FOURCHAUME;2001;BLC;x 12;75 cl
1287;013486;LA CHABLISIENNE  AC CHABLIS 1ER CRU FOURCHAUME;2001;BLC;x 24;37.5 cl
1288;049006;CHATEAU FLAMAND BELLEVUE AC BORDEAUX ROUGE;2001;RGE;x 6;75 cl
1289;022000;DOM LATOUR GIRAUD CUV CHARLES MAXIME;2001;BLC;x 6;75 cl
1290;022001;DOM LATOUR MEURSAULT 1ER CRU CHARMES;0;BLC;x 6;75 cl
1291;022003;DOM LATOUR GENEVRIERES 1ER CRU;2003;BLC;x 6;75 cl
1292;022010;DOM LATOUR PULIGNY MONTRACHET 1ER CRU CHAMPS CANET;2003;BLC;x 6;75 cl
1293;022050;DOM LATOUR VOLNAY CLOS DES CHENES 1ER CRU;0;RGE;x 6;75 cl
1294;022059;DOM LATOUR GIRAUD POMMARD VILLAGE;0;RGE;x 6;75 cl
1295;045001;CH LAFARGUES RGE PESSAC LEOGNAN;2000;RGE;x 6;75 cl
1296;074015;BRUT DU FOUDRE AC GIGONDAS;1999;RGE;x 6;75 cl
1297;074020;SYTERRES AC GIGONDAS;2001;RGE;x 6;75 cl
1298;074025;AC GIGONDAS;2003;RGE;x 1;B05L
1299;016000;AOP BEAUJOLAIS NOUVEAU DME PAIRE BIO;2016;RGE;x 6 CB;75 cl
1300;052021;CH RAMAGE LA BATISSE AC HAUT MEDOC CRU BOURGEOIS C;2010;RGE;x 6;75 cl
1301;052022;CH RAMAGE LA BATISSE AC HAUT MEDOC CRU BOURGEOIS;2009;RGE;x 12;37.5 cl
1302;052058;CH BELCIER AC COTE CASTILLON CAISSE BOIS;2003;RGE;x 1;IMPERIALE
1303;052381;CHATEAU FONGABAN AC PUISSEGUIN ST EMILION;1999;RGE;x 24;37.5 cl
1305;096009;AC GRAVES CH DE L'HOSPITAL (SC);2004;BLC;x 6;75 cl
1306;036002;AC CTX DU LANG. COL DU VENT;2014;RSE;x 6;75 cl
1312;046010;AC COT DU LANG ROBE POURPRE;2013;RGE;x 6;75 cl
1319;042050;CELLIER DES PRINCES VDP ORANGE;0;BLC;x 1;B10L
1320;042060;CELLIER DES PRINCES VDP ORANGE MERLOT;0;RGE;x 1;B10L
1321;052023;AC HT MEDOC CRU.B  R.LA BATISSE (SC);2000;RGE;x 12;37.5 cl
1322;002017;VDP GARD C. GALLICIAN;0;RSE;x 1;B10L
1323;002018;VDP GARD C. GALLICIAN;0;RSE;x 1;B05L
1326;044005;DOMAINE DE CLAPIES VDP OC CUVEE DES MONTILLES;0;RGE;x 1;B10L
1327;009015;LES CHARMILLES AC SANCERRE;2003;BLC;x 6;75 cl
1328;009016;LES CHARMILLES AC SANCERRE;2003;BLC;x 12;37.5 cl
1329;090022;DOMAINE SANTE AC MOULIN A VENT;0;RGE;x 12;37.5 cl
1332;039020;VDN RIVESALTES  AMBRE;2003;BLC;x 6;75 cl
1336;039028;VDN MAURY;2013;RGE;x 6;75 cl
1337;039030;VDN MUSCAT DE RIVESALTES;2013;BLC;x 6;75 cl
1342;052057;AC C CASTILLON. B DE BELCIER;2000;RGE;x 6;75 cl
1346;083001;FAUGERES DE LAURENS AC FAUGERES;2003;RGE;x 1;B10L
1347;083002;FAUGERES DE LAURENS AC FAUGERES;2003;RGE;x 1;B05L
1348;083003;AC FAUGERES C.PREST DE LAURENS;2014;RGE;x 6;75 cl
1349;083005;FAUGERES DE LAURENS AC FAUGERES;2004;RSE;x 1;B10L
1350;083006;FAUGERES DE LAURENS AC FAUGERES;2004;RSE;x 1;B05L
1351;083010;FAUG. DE LAUR. AC FAUGERES CUVEE PRESTIGE;2004;RSE;x 6;75 cl
1353;025027;DME D'ANTUGNAC VDP CHARDONNAY;2004;BLC;x 6;75 cl
1354;057080;BARON DE LYSSART DOUX AOC GAILLAC;2003;BLC;x 6;75 cl
1357;085001;VDP JARDIN DE LA FRANCE SAUVIGNON FLEUR DE LYS;2004;BLC;x 1;B10L
1358;085002;VDP JARDIN DE LA FRANCE SAUVIGNON FLEUR DE LYS;2004;BLC;x 1;B05L
1360;061010;CASSYTA VDP DU TARN ET GARONNE;2004;RGE;x 6;75 cl
1361;061014;CASSYTA VDP DU TARN ET GARONNE;2004;RSE;x 6;75 cl
1362;061016;CASSYTA VDP DU TARN ET GARONNE;2004;BLC;x 6;75 cl
1363;022054;DOM LATOUR GIRAUD POMMARD REFENE 1ER CRU;2001;RGE;x 6;75 cl
1364;022045;DOM LATOUR MARANGES 1ER CRU LA FUSSIERE;2002;RGE;x 6;75 cl
1365;062010;CH CARBON D'ARTIGUES AC GRAVES;2003;RGE;x 6;75 cl
1370;002003;VDP GARD. C GALLICIAN;0;RGE;x 1;B10L
1371;002004;VDP GARD. C GALLICIAN;0;RGE;x 1;B05L
1372;067003;DME DE LA CAMARETTE VDP VAUCLUSE;2004;RGE;x 1;B05L
1373;051133;CLOS TRIMOULET AC ST EMILION GRAND CRU;2011;RGE;x 6;150 cl
1374;051005;CH CHEVALIER ST GEORGES AC MONTAGNE ST EMILION;2009;RGE;x 6;75 cl
1375;051006;CH CHEVALIER ST GEORGES AC MONTAGNE ST EMILION;2011;RGE;x 6;150 cl
1376;040015;AC C DE BOURG. CARACTERE;2012;RGE;x 6;75 cl
1382;068130;D FONTAINE AC PERNAND ILE DES VERGELESSES 1ER CRU;2002;RGE;x 6;75 cl
1385;007021;DOMAINE DUSSOURT AC GEWURZTRAMINER;2010;BLC;x 12;37.5 cl
1386;007022;AC PINOT GRIS D. DUSSOURT SC;2004;BLC;x 24;37.5 cl
1387;092001;DOMAINE HAUT LIROU AC CTX LANG PIC ST LOUP;2003;RGE;x 6;75 cl
1388;025003;DME DEUX ROCHES AC ST VERAN RIVES DE LONGSAULT;2013;BLC;x 6;75 cl
1389;019005;CH LES HAUTS DE PEREY AC BDX SUP;2003;RGE;x 12;37.5 cl
1391;092005;AC CTX LANG L'ESPRIT HT LIROU;2010;RGE;x 6;75 cl
1392;067100;LA FIGUIERE - HUILE D'OLIVE VIERGE EXTRA;0;BLC;x 6;75 cl
1393;078010;CHANTECOTES AC COTES DU RHONE;2004;RSE;x 6;75 cl
1394;062025;CH CARBON D'ARTIGUES AC BORDEAUX;2004;RSE;x 6;75 cl
1395;050015;CH HAUT LIGNIERES AC FAUGERES CUVEE XXL;0;RGE;x 6;75 cl
1396;094001;AC MOULIS EN MEDOC TOUR GRANINS GD-POUJEAUX;2014;RGE;x 6;75 cl
1398;096010;CH DE ROUILLAC AC PESSAC LEOGNAN;2000;RGE;x 6;150 cl
1399;025032;CH D'ANTUGNAC AC LIMOUX;2004;BLC;x 24;37.5 cl
1400;051130;CLOS TRIMOULET AC ST EMILION GRAND CRU;2005;RGE;x 24;37.5 cl
1401;049008;AC BX SUP Tradi  CH LAUDUC;2012;RGE;x 12;37.5 cl
1402;049040;CH LAUDUC AC BORDEAUX CLAIRET;2015;RSE;x 6;75 cl
1404;052003;CH RAMAGE LA BATISSE AC HAUT-MEDOC CRU BOURGEOIS;2004;RGE;x 1;IMPERIALE
1406;094003;AC MOULIS EN MEDOC GD POUJEAUX;2012;RGE;x 6;150 cl
1407;019030;COMTE AUGUSTE BORDEAUX SUPERIEUR;2000;RGE;x 6;75 cl
1408;016030;LES VIGNERONS DU GD SUD AC COTES DE PROVENCE;0;RSE;x 6;75 cl
1411;080017;DOMAINE ST PIERRE AC SANCERRE;0;RGE;x 6;150 cl
1414;033005;CLOS LABARDE AC ST EMILION GRAND CRU;2001;RGE;x 6;75 cl
1415;033006;CLOS LABARDE AC ST EMILION GRAND CRU;2001;RGE;x 6;37.5 cl
1416;105001;CH LES HAUTS D'AGLAN AC CAHORS RGE;2002;RGE;x 6;75 cl
1417;074040;VACQUEYRAS NOIR/OR;2003;RGE;x 6;75 cl
1418;074041;VACQUEYRAS NOIR/OR;2003;RGE;x 12;37.5 cl
1419;045005;CH LAFARGUE AC PESSAC LEOGNAN;2004;BLC;x 6;75 cl
1421;107003;AC MARGAUX CRU.B CH DEYREM VALENTIN (caveau);2005;RGE;x 6;150 cl
1422;053020;VDT ROUGE;2004;RGE;x 1;B10L
1423;053021;VDT ROUGE;2004;RGE;x 1;B05L
1424;053015;COUSINE BERTHE AC ST CHINIAN;2003;RGE;x 6;75 cl
1432;025033;AC LIMOUX Aux Bons Hommes D.D'ANTUGNAC;2012;RGE;x 6;75 cl
1433;075004;AC MEDOC. CH.BREUIL RENAISSANCE;2014;RGE;x 6;150 cl
1434;075010;AC MEDOC CRU.B CH LES CABANS;2008;RGE;x 6;75 cl
1437;028015CB;AC 1ERES C.DE BLAYE LES BERTRANDS;2014;RGE;x 3 CB;75 cl
1438;028008;AC C. DE BLAYE CH L.BERTRANDS;0;RGE;x 1;B05L
1443;075011;AC MEDOC CRU.B CH LES CABANS;2013;RGE;x 6;150 cl
1444;043100;1ERES COTES DE BLAYE;0;RGE;x 1;B03L
1445;043110;BORDEAUX;0;RGE;x 1;B03L
1446;043120;BAILLI DE BOURG;0;RGE;x 1;B03L
1447;043130;COTES DE BOURG;0;RGE;x 1;B03L
1448;043140;BORDEAUX CLAIRET;0;RGE;x 1;B03L
1449;074012;AC GIGONDAS LA REFENCE;2012;RGE;x 6;75 cl
1450;074013;AC B DE VENISE TERRISSIMO;2014;RGE;x 6;75 cl
1452;016009;CAVE CEZARENQUE VDT;2004;RSE;x 1;B10L
1453;079004;DOMAINE CORNE LOUP TAVEL;2004;RSE;x 6;75 cl
1454;079005;DOMAINE CORNE LOUP TAVEL;2004;RSE;x 12;37.5 cl
1455;040017;AC C DE BOURG F.CHENE NECTAR;2012;RGE;x 6;75 cl
1456;001502;PANNIER AC CHAMPAGNE SELECTION BRUT;0;BLC;x 1 CB;150 cl
1458;001504;COFFRET 3 BLLES CHAMPAGNE SELECTION BRUT;0;BLC;x 3 CB;75 cl
1459;071006;BOISSERON MERLOT CABERNET 70/30;2004;RGE;x 1;VRAC
1460;048015;CH GUIBEAU AC PUISSEGUIN ST EMILION;2000;RGE;x 1 CB;150 cl
1461;084001;AC CORBIERES CASTELMAURE;0;RGE;x 1;B10L
1462;084002;AC CORBIERES CASTELMAURE;0;RGE;x 1;B05L
1463;084005;VDT LA BUVETTE (x12);2013;RGE;x 12;75 cl
1464;084006;AOP CORBIERES LE CASTELMAURE;2015;RGE;x 6;75 cl
1465;084007;AC CORBIERES LA POMPADOUR;2014;RGE;x 6;75 cl
1466;114010;AC TOURAINE SAUV D.LA CHAISE;0;BLC;x 1;B10L
1467;114011;AC TOURAINE SAUV D.LA CHAISE;0;BLC;x 1;B05L
1468;010050;(SC) VOUVRAY C.DE ROUGEMONT;2012;BLC;x 6;75 cl
1470;057020;PRINCESSE EMILIE VIELLI FUT;0;RGE;x 6;75 cl
1473;052024;CHATEAU RAMAGE LA BATISSE HAUT MEDOC CRU BOURGEOIS;2009;RGE;x 1;150 cl
1476;041015;CH LES HAUTS DE PEZ AC ST ESTPHE;2012;RGE;x 6;75 cl
1477;044003;VPOC SYRAH D.DE CLAPIES;2006;RGE;x 6;75 cl
1482;109003;EXPRESSION AC COSTIERES DE NIMES;2005;BLC;x 6;75 cl
1484;067011;TEMPRANILLO VDP;2005;RGE;x 6;75 cl
1485;041008;CH TOUR DE PEZ AC ST ESTEPHE;2006;RGE;x 12;37.5 cl
1488;073010;CHATEAU TALBOT ST JULIEN 4 CRU CLASSE;2003;RGE;x 6;150 cl
1491;078009;CHANTE BLANC VDP ORANGE;2005;BLC;x 6;75 cl
1492;013850;LA CHABLISIENNE AC CHABLIS;0;BLC;x 1;B10L
1494;116001;AC CHINON LES GRAVES;2015;RGE;x 6;75 cl
1496;117001;CUVEE BARON LAMORAL D'OSTREL AC CTX DU LANGU;2003;RGE;x 6;75 cl
1499;001900;COFFRET 3 BOUTEILLES P5010;0;BLC;x 1;75 cl
1502;109004;ELEGANCE AC COSTIERES DE NIMES;2004;RGE;x 6;75 cl
1503;109005;HARMONIE AC COSTIERES DE NIMES;2001;RGE;x 6;75 cl
1504;109010;AC COSTIERES DE NIMES;2005;RGE;x 1;B10L
1505;109011;AC COSTIERES DE NIMES;2005;RGE;x 1;B05L
1506;109012;AC COSTIERES DE NIMES;2005;RSE;x 1;B10L
1507;109013;AC COSTIERES DE NIMES;2005;RSE;x 1;B05L
1508;073020;CH LA TOUR L'ASPIC AC PAUILLAC 2ème vin;0;RGE;x 6;75 cl
1509;113001;AC MENETOU SALON. DME PRIEURE;2015;BLC;x 6;75 cl
1510;113002;AC MENETOU SALON. DME PRIEURE;2015;BLC;x 12;37.5 cl
1511;113005;AC MENETOU SALON. DME PRIEURE;2014;RGE;x 6;75 cl
1512;113006;AC MENETOU SALON. DME PRIEURE;2015;RGE;x 12;37.5 cl
1515;118001;FINE ARMAGNAC ARIANE sans étui;0;RGE;x 6;70 cl
1516;052500;CH PETIT FOMBRAUGE AC ST EMILION GD CRU;1998;RGE;x 6;75 cl
1517;075012;AC MEDOC CRU.B CH LES CABANS;2005;RGE;x 12;37.5 cl
1518;099004;DME VILLEMARIN VDP COTES DE THAU;2005;RGE;x 6;75 cl
1520;119001;AC MINERVOIS CUVEE PAUL D.DES HOMS;2014;RGE;x 6;75 cl
1522;089901;AC SAUMUR D.LA PALEINE;0;RGE;x 1;B05L
1523;031026;LES ROCHES NOIRES AC MUSCADET S&M/LIE;2005;BLC;x 6;75 cl
1524;031027;LES ROCHES NOIRES AC MUSCADET S&M/LIE;2005;BLC;x 12;37.5 cl
1525;013059;LA CHABLISIENNE AC PETIT CHABLIS;0;BLC;x 1;B03L
1526;025034;AC LIMOUX TERRES AMOUREUSES;0;BLC;x 6;75 cl
1527;089300;DOM PALEINE AC SAUMUR MULTA PAUCIS;0;BLC;x 6;75 cl
1528;089400;DOM PALEINE AC CABERNET DE SAUMUR;0;RGE;x 6;75 cl
1529;120001;AC COTEAUX DU LANGUEDOC;2005;RSE;x 6;75 cl
1530;031087;AC MUSCADET SEVRE ET MAINE;2005;BLC;x 1;B10L
1532;031088;VDP DU JARDIN DE LA FRANCE CEPAGE SAUVIGNON;2005;BLC;x 1;B10L
1533;031089;VIN DE TABLE 11 SEC BOISSELIERE;2005;BLC;x 1;B10L
1534;013017;VDP BOURGOGNE CHARDONNAY;0;BLC;x 1;B10L
1535;069017;AC MUSCADET SEVRE ET MAINE;2007;BLC;x 1;B10L
1536;121001;Cuvée Première AC CHAMPAGNE CHASSENAY D'ARCE;0;BLC;x 6;75 cl
1537;049100;CH FLAMAND BELLEVUE AC BDX;0;RGE;x 1;B10L
1538;011009;AC VOUVRAY SEC C.LANTERNE;2004;BLC;x 6;75 cl
1539;069002;DME DES AUDINIERES MOUSSEUX BRUT;0;BLC;x 6;75 cl
1540;115007;Chateau des Roques AC VACQUEYRAS;2014;BLC;x 6;75 cl
1541;078012;BEAUMES DE VENISE;2004;BLC;x 6;75 cl
1542;042097;CHATEAUNEUF DU PAPE;2005;BLC;x 6;75 cl
1543;069003;VDP JARDIN DE LA FRANCE BLANC;2005;BLC;x 1;B10L
1544;012001.1;PIERRES CHAUDES VDP DUCHE D'UZES ROUGE;2003;RGE;x 6;75 cl
1545;122001;Chateau Viella AC MADIRAN TRADITION;2004;RGE;x 6;75 cl
1546;057004;CROIS XT SALVY AC GAILLAC ROUGE;2005;RGE;x 6;75 cl
1547;089011;SAUMUR BLANC DOMAINE DE LA PALEINE;2002;BLC;x 12;37.5 cl
1549;002021;AC COSTIERES DE NIMES CUVEE PRESTIGE;2014;BLC;x 6;75 cl
1550;007009;AC PINOT BLANC DOMAINE DUSSOURT;2004;BLC;x 6;75 cl
1551;124001;AC M ST EMILION CH BECHEREAU;2012;RGE;x 6;75 cl
1552;124002;AC BORDEAUX SUP TRADITION CH BECHEREAU;2012;RGE;x 6;75 cl
1553;124005CB;AC MONTAGNE CH BECHEREAU CB;2011;RGE;x 3;75 cl
1556;087004;AC REUILLY LES BOUCHAUDS;2005;RGE;x 12;37.5 cl
1557;092002;AC CX LANG P.ST LOUP.M DES COSTES;2012;RGE;x 6;75 cl
1559;096007;AC GRAVES CH DE L'HOSPITAL;2009;RGE;x 6;150 cl
1560;110500;AC BERGERAC CH LES MARNIERES;0;RGE;x 1;B10L
1565;049001;CH LAUDUC AC BORDEAUX SUPERIEUR CUVEE PRESTIGE;2002;RGE;x 6;75 cl
1566;049002;CH GALIAS AC BORDEAUX;2003;RGE;x 6;75 cl
1568;052054;CH DE BELCIER AC COTES DE CASTILLON;2007;RGE;x 12 CB;75 cl
1569;052300;CH HAUT BARADIEU AC ST ESTEPHE CRU BOURGEOIS;2002;RGE;x 6;75 cl
1570;074006;CAISSE BOIS INITIATION 6 BLLES + 6 VERRES INAO;0;RGE;x 6;75 cl
1571;074007;GIGONDAS Signature JERO CAISSE BOIS;2013;RGE;x 1;Jéroboam
1572;074008;GIGONDAS NOIR ET OR CAISSE BOIS;2000074;RGE;x 1;150 cl
1573;074009;GIGONDAS CAISSE BOIS;2000;RGE;x 1;Mathusalem
1577;118002;FINE ARMAGNAC 40% vol Ariane avec étui;0;RGE;x 1;70 cl
